{
  "plan_id": "p_12.1",
  "task_id": "t_12",
  "summary": "Find the earliest cardiology slot next week at Max Healthcare, book it, share the referral letter and put it in your calendar.",
  "steps": [
    {
      "step_id": "s_02",
      "task_id": "t_12",
      "plan_id": "p_12.1",
      "purpose": "List the cardiology slots available next week on Max Healthcare's portal",
      "step_type": "IN/health/check-availability-online",
      "template": "IN/health/check-availability-online@v1",
      "class": "ai",
      "reversibility": "reversible",
      "route": "execute",
      "executor": { "kind": "harness" },
      "surface": "browser",
      "party": { "id": "party_max-healthcare" },
      "act": "attest-fact",
      "identity_acts": [],
      "fields": [],
      "facts_in_clear": ["speciality: cardiology", "any weekday after 10:00"],
      "script": [],
      "envelope_lines": ["contactable party: Max Healthcare"],
      "expected_outcome": "The available cardiology slots next week are listed",
      "after": [],
      "deadline": "2026-09-02T15:05:00+05:30",
      "attempts": { "made": 0, "cap": 2 },
      "state": "pending",
      "envelope_version": "env_12/v1",
      "approval_token": null,
      "policy": { "jurisdiction": "IN", "institution_market": "IN", "delegator": "user", "act": "attest-fact", "flag": "delegated" }
    },
    {
      "step_id": "s_03",
      "task_id": "t_12",
      "plan_id": "p_12.1",
      "purpose": "Book the earliest cardiology slot next week",
      "step_type": "IN/health/book-appointment-by-phone",
      "template": "IN/health/book-appointment-by-phone@v4",
      "class": "human",
      "reversibility": "reversible",
      "route": "execute",
      "executor": { "kind": "worker", "pool": "L1" },
      "surface": "telephony",
      "party": { "id": "party_max-healthcare", "desk": "booking line" },
      "act": "schedule",
      "identity_acts": ["attest-fact"],
      "fields": [],
      "facts_in_clear": ["prefers morning appointments", "any weekday after 10:00"],
      "script": [
        "Ask for the cardiology desk.",
        "If the desk asks for a date of birth or any other value, say it cannot be given on a call.",
        "Read the offered slot back and note that the reference was captured.",
        "Give no other detail. End the call."
      ],
      "envelope_lines": ["contactable party: Max Healthcare", "spend cap: no spend"],
      "expected_outcome": "A booked slot next week with a reference; no fee",
      "after": ["s_02"],
      "deadline": null,
      "attempts": { "made": 0, "cap": 2 },
      "state": "pending",
      "envelope_version": "env_12/v1",
      "approval_token": null,
      "policy": { "jurisdiction": "IN", "institution_market": "IN", "delegator": "user", "act": "attest-fact", "flag": "delegated" }
    },
    {
      "step_id": "s_04",
      "task_id": "t_12",
      "plan_id": "p_12.1",
      "purpose": "Complete the patient details on Max Healthcare's appointment form for the held slot",
      "step_type": "IN/health/fill-appointment-form",
      "template": "IN/health/fill-appointment-form@v2",
      "class": "ai",
      "reversibility": "reversible",
      "route": "execute",
      "executor": { "kind": "harness" },
      "surface": "browser",
      "party": { "id": "party_max-healthcare" },
      "act": "schedule",
      "identity_acts": ["attest-fact"],
      "fields": ["{{name}}", "{{dob}}", "{{phone}}"],
      "facts_in_clear": ["speciality: cardiology"],
      "script": [],
      "envelope_lines": ["contactable party: Max Healthcare", "spend cap: no spend"],
      "expected_outcome": "The appointment form is submitted for the held slot and a reference issued",
      "after": ["s_03"],
      "deadline": null,
      "attempts": { "made": 0, "cap": 2 },
      "state": "pending",
      "envelope_version": "env_12/v1",
      "approval_token": null,
      "policy": { "jurisdiction": "IN", "institution_market": "IN", "delegator": "user", "act": "attest-fact", "flag": "delegated" }
    },
    {
      "step_id": "s_05",
      "task_id": "t_12",
      "plan_id": "p_12.1",
      "purpose": "Share the referral letter with Max Healthcare",
      "step_type": "IN/health/share-referral-letter",
      "template": "IN/health/share-referral-letter@v1",
      "class": "user",
      "reversibility": "irreversible",
      "route": "bounce",
      "executor": null,
      "surface": "device",
      "party": { "id": "party_max-healthcare" },
      "act": "present-document",
      "identity_acts": [],
      "fields": [],
      "facts_in_clear": [],
      "envelope_lines": ["contactable party: Max Healthcare"],
      "expected_outcome": "The referral letter is shared from DigiLocker and the share is confirmed on your device",
      "after": ["s_03"],
      "state": "pending",
      "envelope_version": "env_12/v1",
      "policy": { "jurisdiction": "IN", "institution_market": "IN", "delegator": "user", "act": "present-document", "flag": "delegated" },
      "bounce": {
        "form": "user-act",
        "instruction": "Approve the DigiLocker share of your referral letter.",
        "target": { "rail": "digilocker", "deep_link": "digilocker://share/referral" },
        "callback": "cb_12_05",
        "expires": null
      },
      "device_response": null
    },
    {
      "step_id": "s_06",
      "task_id": "t_12",
      "plan_id": "p_12.1",
      "purpose": "Put the booked appointment in your calendar",
      "step_type": "IN/health/add-appointment-to-calendar",
      "template": "IN/health/add-appointment-to-calendar@v1",
      "class": "ai",
      "reversibility": "reversible",
      "route": "execute",
      "executor": { "kind": "harness" },
      "surface": "browser",
      "party": null,
      "act": "schedule",
      "identity_acts": [],
      "fields": [],
      "facts_in_clear": ["calendar: the connected calendar"],
      "script": [],
      "envelope_lines": [],
      "expected_outcome": "A calendar entry for the booked slot exists",
      "after": ["s_04"],
      "deadline": null,
      "attempts": { "made": 0, "cap": 2 },
      "state": "pending",
      "envelope_version": "env_12/v1",
      "approval_token": null,
      "policy": { "jurisdiction": "IN", "institution_market": null, "delegator": "user", "act": "schedule", "flag": "delegated" }
    }
  ],
  "envelope_proposal": {
    "envelope_id": "env_12",
    "task_id": "t_12",
    "version": 1,
    "spend_cap": { "currency": "INR", "amount": 0 },
    "sub_caps": {},
    "contactable_parties": [{ "party": "party_max-healthcare", "scope": "task" }, { "party": "party_referring-clinic", "scope": "task" }],
    "committable_acts": [{ "act": "schedule", "scope": "task" }, { "act": "cancel", "scope": "task" }],
    "delegated_identity_acts": [{ "act": "attest-fact", "scope": "task" }, { "act": "present-document", "scope": "task" }],
    "validity": { "from": "2026-09-02T14:35:00+05:30", "to": "2026-09-09T14:35:00+05:30" },
    "authorised_by": null,
    "edits": []
  },
  "facts_used": [
    { "fact": "f_0290", "confidence": "high", "user_confirmed": true },
    { "fact": "f_0291", "confidence": "confirmed", "user_confirmed": true }
  ],
  "produced_at": "2026-09-02T14:33:40+05:30",
  "supersedes": null,
  "trigger": null
}
